Symbol,Name,Last Sale,Net Change,% Change,Market Cap,Country,IPO Year,Volume,Sector,Industry
LATNW,Union Acquisition Corp. II Warrant,$1.30,0.035,2.767%,0.00,United States,2019,110246,Finance,Business Services
LAUR,Laureate Education Inc. Class A Common Stock,$14.53,0.55,3.934%,3052353759.00,United States,2017,551353,Consumer Services,Other Consumer Services
LAWS,Lawson Products Inc. Common Stock,$51.17,0.70,1.387%,462081833.00,United States,,16141,Consumer Durables,Industrial Specialties
LAZR,Luminar Technologies Inc.  Class A Common Stock,$32.75,-0.60,-1.799%,10608911860.00,United States,2019,9270012,Capital Goods,Auto Parts:O.E.M.
LAZRW,Luminar Technologies Inc. Warrant,$21.19,-0.55,-2.53%,0.00,United States,2019,390291,Capital Goods,Auto Parts:O.E.M.
LAZY,Lazydays Holdings Inc. Common Stock,$19.97,1.24,6.62%,188753464.00,United States,,134839,Consumer Durables,Automotive Aftermarket
LBAI,Lakeland Bancorp Inc. Common Stock,$14.85,0.56,3.919%,749622743.00,United States,,137142,Finance,Major Banks
LBC,Luther Burbank Corporation Common Stock,$10.20,0.20,2.00%,532646713.00,United States,2017,103384,Finance,Major Banks
LBRDA,Liberty Broadband Corporation Class A Common Stock,$147.90,1.27,0.866%,35480207682.00,United States,,87463,Consumer Services,Television Services
LBRDK,Liberty Broadband Corporation Class C Common Stock,$150.03,1.42,0.956%,35991180247.00,United States,,1237715,Consumer Services,Television Services
LBRDP,Liberty Broadband Corporation Series A Cumulative Redeemable Preferred Stock,$28.46,0.05,0.176%,0.00,United States,,3806,Public Utilities,Telecommunications Equipment
LBTYA,Liberty Global plc Class A Ordinary Shares,$24.98,0.36,1.462%,14565991802.00,United Kingdom,,1738956,,
LBTYB,Liberty Global plc Class B Ordinary Shares,$24.92,0.92,3.833%,14531005432.00,United Kingdom,,700,Consumer Services,Television Services
LBTYK,Liberty Global plc Class C Ordinary Shares,$24.78,0.42,1.724%,14449370570.00,United Kingdom,,1925130,,
LCAP,Lionheart Acquisition Corp. II Class A Common Stock,$10.52,-0.06,-0.567%,309288000.00,United States,2020,115016,Finance,Business Services
LCAPU,Lionheart Acquisition Corp. II Unit,$11.17,-0.06,-0.534%,0.00,United States,2020,11111,Finance,Business Services
LCAPW,Lionheart Acquisition Corp. II Warrant,$1.55,-0.01,-0.641%,0.00,United States,2020,78960,Finance,Business Services
LCNB,LCNB Corporation Common Stock,$16.89,0.30,1.808%,217177109.00,United States,,69654,Finance,Major Banks
LCUT,Lifetime Brands Inc. Common Stock,$14.35,-0.02,-0.139%,312371087.00,United States,1991,38431,Capital Goods,Industrial Machinery/Components
LCY,Landcadia Holdings III Inc. Class A Common Stock,$10.95,-0.03,-0.273%,684375000.00,United States,2020,1617437,Technology,Computer Software: Prepackaged Software
LCYAU,Landcadia Holdings III Inc. Unit ,$11.50,-0.06,-0.519%,0.00,United States,2020,399101,Finance,Business Services
LCYAW,Landcadia Holdings III Inc. Warrant,$1.80,-0.21,-10.448%,0.00,United States,2020,671587,Finance,Business Services
LE,Lands' End Inc. Common Stock,$30.80,-0.40,-1.282%,1004318916.00,United States,,117164,Consumer Services,Clothing/Shoe/Accessory Stores
LECO,Lincoln Electric Holdings Inc. Common Shares,$116.18,0.97,0.842%,6909307320.00,United States,,377294,Technology,Industrial Machinery/Components
LEDS,SemiLEDS Corporation Common Stock,$3.97,-0.2837,-6.669%,15924952.00,Taiwan,2010,454587,Technology,Semiconductors
LEGH,Legacy Housing Corporation Common Stock (TX),$16.77,0.59,3.646%,405702473.00,United States,2018,24631,Basic Industries,Homebuilding
LEGN,Legend Biotech Corporation American Depositary Shares,$27.34,-0.11,-0.401%,3533491399.00,United States,2020,291026,Health Care,Major Pharmaceuticals
LEGOU,Legato Merger Corp. Units,$10.56,0.04,0.38%,0.00,United States,2021,167066,Finance,Business Services
LESL,Leslie's Inc. Common Stock,$27.74,-0.31,-1.105%,5176456682.00,United States,2020,616732,Consumer Services,Other Specialty Stores
LEVL,Level One Bancorp Inc. Common Stock,$23.72,1.44,6.463%,181073262.00,United States,2018,29592,Finance,Major Banks
LEVLP,Level One Bancorp Inc. Depositary Shares Each Representing a 1/100th Interest in a Share of 7.50% Non-Cumulative Perpetual Preferred Stock Series B,$26.549,0.049,0.185%,0.00,United States,,200,Finance,Major Banks
LEXX,Lexaria Bioscience Corp. Common Stock,$7.44,0.24,3.333%,37976230.00,Canada,,354453,Health Care,Major Pharmaceuticals
LEXXW,Lexaria Bioscience Corp. Warrant,$2.9967,0.0967,3.334%,0.00,Canada,,27461,Health Care,Major Pharmaceuticals
LFTR,Lefteris Acquisition Corp. Class A Common Stock,$10.95,0.07,0.643%,283466680.00,United States,2020,296632,Finance,Business Services
LFTRU,Lefteris Acquisition Corp. Unit,$11.67,0.08,0.69%,0.00,United States,2020,36020,Finance,Business Services
LFTRW,Lefteris Acquisition Corp. Warrant,$2.27,0.14,6.573%,0.00,United States,2020,181261,Finance,Business Services
LFUS,Littelfuse Inc. Common Stock,$268.02,6.02,2.298%,6533000633.00,United States,,99786,Consumer Durables,Electrical Products
LFVN,Lifevantage Corporation Common Stock (Delaware),$10.21,0.53,5.475%,144640823.00,United States,,180016,Health Care,Major Pharmaceuticals
LGHL,Lion Group Holding Ltd. American Depositary Share,$3.70,0.25,7.246%,72041401.00,China,,3461273,Finance,Investment Bankers/Brokers/Service
LGHLW,Lion Group Holding Ltd. Warrant,$0.4059,0.0864,27.042%,0.00,China,,550885,Finance,Investment Bankers/Brokers/Service
LGIH,LGI Homes Inc. Common Stock,$119.00,2.70,2.322%,2986950694.00,United States,2013,283633,Capital Goods,Homebuilding
LGND,Ligand Pharmaceuticals Incorporated Common Stock,$208.23,5.20,2.561%,3348613055.00,United States,,575760,Health Care,Major Pharmaceuticals
LHCG,LHC Group Common Stock,$206.14,1.95,0.955%,6512428270.00,United States,2005,138865,Health Care,Medical/Nursing Services
LHDX,Lucira Health Inc. Common Stock,$28.89,3.91,15.653%,1036203408.00,United States,2021,1090147,,
LI,Li Auto Inc. American Depositary Shares,$30.36,-0.04,-0.132%,27250958546.00,China,2020,12331220,Capital Goods,Auto Manufacturing
LIFE,aTyr Pharma Inc. Common Stock,$8.06,2.52,45.487%,82094791.00,United States,2015,10721236,Health Care,Biotechnology: Biological Products (No Diagnostic Substances)
LILA,Liberty Latin America Ltd. Class A Common Stock,$11.99,0.89,8.018%,2781756892.00,United States,,404908,Consumer Services,Television Services
LILAK,Liberty Latin America Ltd. Class C Common Stock,$11.86,0.92,8.41%,2751596058.00,United States,,1525198,Consumer Services,Television Services
LINC,Lincoln Educational Services Corporation Common Stock,$6.11,-0.11,-1.768%,161770370.00,United States,2005,130002,Consumer Services,Other Consumer Services
LIND,Lindblad Expeditions Holdings Inc. Common Stock,$18.95,0.825,4.552%,945134775.00,United States,2013,549025,Consumer Services,Transportation Services
LIQT,LiqTech International Inc. Common Stock,$11.95,1.02,9.332%,258782759.00,Denmark,,313071,Technology,Industrial Machinery/Components
LITE,Lumentum Holdings Inc. Common Stock,$88.14,-0.64,-0.721%,6672198000.00,United States,,3559943,Capital Goods,Telecommunications Equipment
LIVE,Live Ventures Incorporated Common Stock,$28.86,0.33,1.157%,44882351.00,United States,,26602,Consumer Services,Other Specialty Stores
LIVK,LIV Capital Acquisition Corp. Class A Ordinary Shares,$10.35,0.12,1.173%,104871375.00,Mexico,2020,87651,Finance,Business Services
LIVKU,LIV Capital Acquisition Corp. Unit,$11.15,-0.0301,-0.269%,0.00,Mexico,2019,220,Finance,Business Services
LIVKW,LIV Capital Acquisition Corp. Warrant,$1.20,0.11,10.092%,0.00,Mexico,2020,66230,Finance,Business Services
LIVN,LivaNova PLC Ordinary Shares,$70.21,2.58,3.815%,3411954438.00,United Kingdom,,260890,Health Care,Biotechnology: Electromedical & Electrotherapeutic Apparatus
LIVX,LiveXLive Media Inc. Common Stock,$4.50,0.13,2.975%,337944119.00,United States,,1018488,Consumer Services,Restaurants
LIXT,Lixte Biotechnology Holdings Inc. Common Stock,$3.70,0.32,9.467%,45784917.00,United States,,69734,Health Care,Major Pharmaceuticals
LIXTW,Lixte Biotechnology Holdings Inc. Warrants,$1.15,0.015,1.322%,0.00,United States,,11141,Health Care,Major Pharmaceuticals
LIZI,LIZHI INC. American Depositary Shares,$12.79,1.39,12.193%,590065192.00,China,2020,6746005,Technology,Computer Software: Programming Data Processing
LJAQU,LightJump Acquisition Corporation Unit,$10.46,0.07,0.674%,0.00,United States,2021,213921,Finance,Business Services
LJPC,La Jolla Pharmaceutical Company Common Stock,$7.34,0.27,3.819%,200977971.00,United States,1994,467532,Health Care,Biotechnology: Biological Products (No Diagnostic Substances)
LKCO,Luokung Technology Corp Ordinary Shares,$0.7206,0.0806,12.594%,152969059.00,China,,16304353,Technology,EDP Services
LKFN,Lakeland Financial Corporation Common Stock,$64.14,2.14,3.452%,1618877437.00,United States,,110635,Finance,Major Banks
LKQ,LKQ Corporation Common Stock,$38.24,0.33,0.87%,11638163507.00,United States,,1323884,Consumer Services,Motor Vehicles
LLIT,Lianluo Smart Limited Class A Common Stock,$7.84,0.42,5.66%,3527577.00,China,,763583,Consumer Services,Other Specialty Stores
LLNW,Limelight Networks Inc. Common Stock,$4.54,0.11,2.483%,558300625.00,United States,2007,3857669,Miscellaneous,Business Services
LMACU,Liberty Media Acquisition Corporation Unit,$12.28,-0.12,-0.968%,0.00,United States,2021,230218,Finance,Business Services
LMAOU,LMF Acquisition Opportunities Inc. Unit,$10.45,0.02,0.192%,0.00,United States,2021,38312,Finance,Business Services
LMAT,LeMaitre Vascular Inc. Common Stock,$48.20,-0.07,-0.145%,980483677.00,United States,2006,123927,Health Care,Medical/Dental Instruments
LMB,Limbach Holdings Inc. Common Stock,$15.23,0.27,1.805%,120715067.00,United States,,157428,Basic Industries,Engineering & Construction
LMFA,LM Funding America Inc. Common Stock,$2.00,0.17,9.29%,53047598.00,United States,2015,4935180,Finance,Finance: Consumer Services
LMNL,Liminal BioSciences Inc. Common Shares,$5.49,0.27,5.172%,161328838.00,Canada,,1878369,Health Care,Major Pharmaceuticals
LMNR,Limoneira Co Common Stock,$16.10,0.27,1.706%,284240799.00,United States,,39245,Consumer Non-Durables,Farming/Seeds/Milling
LMNX,Luminex Corporation Common Stock,$30.07,0.50,1.691%,1399021575.00,United States,2000,556782,Health Care,Medical/Dental Instruments
LMPX,LMP Automotive Holdings Inc. Common Stock,$23.00,-0.60,-2.542%,227779419.00,United States,2019,118290,Consumer Durables,Automotive Aftermarket
LMRK,Landmark Infrastructure Partners LP Common Units,$11.82,-0.14,-1.171%,301150456.00,United States,2014,71625,Consumer Services,Real Estate
LMRKN,Landmark Infrastructure Partners LP 7% Series C Fltg/Fxd Perpetual Conv Preferred Stock,$25.99,-0.051,-0.196%,0.00,United States,,12718,Consumer Services,Real Estate
LMRKO,Landmark Infrastructure Partners LP Perpetual Preferred Units Series B 7.90%,$25.2001,-0.0146,-0.058%,0.00,United States,,3091,Consumer Services,Real Estate
LMRKP,Landmark Infrastructure Partners LP 8.00% Series A Cumulative Redeemable Perpetual Preferred Units,$25.36,0.11,0.436%,0.00,United States,,3534,Consumer Services,Real Estate
LMST,Limestone Bancorp Inc. Common Stock,$14.19,-0.17,-1.184%,106427228.00,United States,,10712,Finance,Major Banks
LNDC,Landec Corporation Common Stock (DE),$11.11,0.16,1.461%,325780230.00,United States,1996,76792,Consumer Non-Durables,Packaged Foods
LNSR,LENSAR Inc. Common Stock,$8.15,0.65,8.667%,86706375.00,United States,,47143,Health Care,Medical/Dental Instruments
LNT,Alliant Energy Corporation Common Stock,$49.06,-0.62,-1.248%,12253258127.00,United States,,875717,Public Utilities,Power Generation
LNTH,Lantheus Holdings Inc. Common Stock,$19.60,0.80,4.255%,1310678558.00,United States,2015,886113,Health Care,Biotechnology: In Vitro & In Vivo Diagnostic Substances
LOAC,Longevity Acquisition Corporation Ordinary Shares,$12.99,-0.03,-0.23%,34122418.00,China,2018,166677,Finance,Business Services
LOACR,Longevity Acquisition Corporation Right,$1.25,0.00,0.00%,0.00,China,2018,6200,Finance,Business Services
LOACU,Longevity Acquisition Corporation Units,$15.83,0.00,0.00%,0.00,China,2018,42,Finance,Business Services
LOACW,Longevity Acquisition Corporation Warrant,$1.94,0.04,2.105%,0.00,China,2018,178264,Finance,Business Services
LOAN,Manhattan Bridge Capital Inc,$5.45,0.13,2.444%,52428700.00,United States,,54015,Consumer Services,Real Estate Investment Trusts
LOB,Live Oak Bancshares Inc. Common Stock,$43.82,0.70,1.623%,1860266184.00,United States,2015,207240,Finance,Major Banks
LOCO,El Pollo Loco Holdings Inc. Common Stock,$19.60,-0.95,-4.623%,714356026.00,United States,2014,306009,Consumer Services,Restaurants
LOGC,LogicBio Therapeutics Inc. Common Stock,$9.16,0.55,6.388%,291164212.00,United States,2018,175740,Health Care,Biotechnology: Biological Products (No Diagnostic Substances)
LOGI,Logitech International S.A. Ordinary Shares,$113.82,1.97,1.761%,19226625325.00,United States,1997,950129,Technology,Computer peripheral equipment
LOOP,Loop Industries Inc. Common Stock,$11.93,0.60,5.296%,505995334.00,Canada,,154691,Basic Industries,Major Chemicals
LOPE,Grand Canyon Education Inc. Common Stock,$96.27,2.18,2.317%,4510928974.00,United States,2008,228996,Consumer Services,Other Consumer Services
LORL,Loral Space and Communications Inc. Common Stock,$33.05,2.14,6.923%,1022327421.00,United States,,312525,Technology,Radio And Television Broadcasting And Communications Equipment
LOTZ,CarLotz Inc. Class A Common Stock,$9.08,-0.51,-5.318%,1031627314.00,United States,2019,9685105,Consumer Durables,Automotive Aftermarket
LOTZW,CarLotz Inc. Warrant,$2.20,-0.11,-4.762%,0.00,United States,2019,513247,Consumer Durables,Automotive Aftermarket
LOVE,The Lovesac Company Common Stock,$55.19,-2.38,-4.134%,810362386.00,United States,2018,287781,Consumer Services,Other Specialty Stores
LPCN,Lipocine Inc. Common Stock,$1.94,0.09,4.865%,169435373.00,United States,,5588378,Health Care,Major Pharmaceuticals
LPLA,LPL Financial Holdings Inc. Common Stock,$123.85,-1.83,-1.456%,9842449539.00,United States,2010,903509,Finance,Investment Bankers/Brokers/Service
LPRO,Open Lending Corporation Class A Common Stock,$41.83,2.41,6.114%,4837635693.00,United States,,812327,Finance,Finance: Consumer Services
LPSN,LivePerson Inc. Common Stock,$68.56,-1.68,-2.392%,4585648078.00,United States,2000,989300,Technology,Computer Software: Prepackaged Software
LPTH,LightPath Technologies Inc. Class A Common Stock,$3.98,0.13,3.377%,104030402.00,United States,1996,655864,Technology,Semiconductors
LPTX,Leap Therapeutics Inc. Common Stock,$2.67,0.04,1.521%,159286171.00,United States,,898511,Health Care,Major Pharmaceuticals
LQDA,Liquidia Corporation Common Stock,$3.47,0.30,9.464%,150261001.00,United States,2018,1725410,Health Care,Biotechnology: Biological Products (No Diagnostic Substances)
LQDT,Liquidity Services Inc. Common Stock,$17.75,0.59,3.438%,619891273.00,United States,2006,386737,Miscellaneous,Business Services
LRCX,Lam Research Corporation Common Stock,$532.78,23.02,4.516%,76138692066.00,United States,1984,1464268,Technology,Industrial Machinery/Components
LRMR,Larimar Therapeutics Inc. Common Stock,$18.87,0.33,1.78%,289771607.00,United States,2014,357461,Health Care,Major Pharmaceuticals
LSAQ,LifeSci Acquisition II Corp. Common Stock,$10.79,-0.07,-0.645%,108021938.00,United States,2020,7233,Finance,Business Services
LSBK,Lake Shore Bancorp Inc. Common Stock,$15.32,1.88,13.988%,89285695.00,United States,,4983,Finance,Savings Institutions
LSCC,Lattice Semiconductor Corporation Common Stock,$44.10,1.10,2.558%,6004473867.00,United States,,1081310,Technology,Semiconductors
LSEA,Landsea Homes Corporation Common Stock,$9.45,0.13,1.395%,436883186.00,United States,2018,118790,Capital Goods,Homebuilding
LSEAW,Landsea Homes Corporation Warrant,$0.28,0.0139,5.224%,0.00,United States,2018,533595,Capital Goods,Homebuilding
LSTR,Landstar System Inc. Common Stock,$149.69,1.35,0.91%,5746009770.00,United States,1993,222294,Transportation,Trucking Freight/Courier Services
LSXMA,Liberty Media Corporation Series A Liberty SiriusXM Common Stock,$43.69,0.31,0.715%,14870548685.00,United States,,285933,Consumer Services,Broadcasting
LSXMB,Liberty Media Corporation Series B Liberty SiriusXM Common Stock,$44.17,0.00,0.00%,15033923905.00,United States,,274,Consumer Services,Broadcasting
LSXMK,Liberty Media Corporation Series C Liberty SiriusXM Common Stock,$42.94,0.17,0.397%,14615274903.00,United States,,676290,Consumer Services,Broadcasting
LTBR,Lightbridge Corporation Common Stock,$8.20,0.93,12.792%,46178800.00,United States,,317689,Consumer Services,Professional Services
LTRN,Lantern Pharma Inc. Common Stock,$17.90,0.66,3.828%,199922684.00,United States,2020,144401,Health Care,Major Pharmaceuticals
LTRPA,Liberty TripAdvisor Holdings Inc. Series A Common Stock,$5.09,0.03,0.593%,382362658.00,United States,,636646,Technology,EDP Services
LTRPB,Liberty TripAdvisor Holdings Inc. Series B Common Stock,$32.00,0.00,0.00%,2403851680.00,United States,,465,Technology,EDP Services
LTRX,Lantronix Inc. Common Stock,$4.98,0.20,4.184%,142383125.00,United States,2000,380585,Technology,Computer Communications Equipment
LULU,lululemon athletica inc. Common Stock,$339.71,5.63,1.685%,44277137267.00,Canada,2007,1038793,Consumer Non-Durables,Apparel
LUMO,Lumos Pharma Inc. Common Stock,$18.62,0.28,1.527%,154491220.00,United States,2011,80601,Health Care,Major Pharmaceuticals
LUNA,Luna Innovations Incorporated Common Stock,$11.92,0.52,4.561%,367589675.00,United States,2006,314100,Health Care,Biotechnology: Commercial Physical & Biological Resarch
LUNG,Pulmonx Corporation Common Stock,$60.01,-0.23,-0.382%,2140493870.00,United States,2020,140281,Health Care,Medical/Dental Instruments
LUXA,Lux Health Tech Acquisition Corp. Class A Common Stock,$11.65,0.35,3.097%,502406250.00,United States,2020,497285,Finance,Business Services
LUXAU,Lux Health Tech Acquisition Corp. Units,$12.50,0.29,2.375%,0.00,United States,2020,183030,Finance,Business Services
LUXAW,Lux Health Tech Acquisition Corp. Warrants,$2.90,0.10,3.571%,0.00,United States,2020,45435,Finance,Business Services
LWACU,Locust Walk Acquisition Corp. Unit,$10.38,-0.05,-0.479%,0.00,United States,2021,68200,Finance,Business Services
LWAY,Lifeway Foods Inc. Common Stock,$6.285,-0.015,-0.238%,98074157.00,United States,,26409,Consumer Non-Durables,Packaged Foods
LX,LexinFintech Holdings Ltd. American Depositary Shares,$9.97,-0.02,-0.20%,1803171448.00,China,2017,5348745,Finance,Finance: Consumer Services
LXEH,Lixiang Education Holding Co. Ltd. American Depositary Shares,$8.20,-0.53,-6.071%,109333880.00,China,2020,16367,Consumer Services,Other Consumer Services
LXRX,Lexicon Pharmaceuticals Inc. Common Stock,$8.685,0.19,2.237%,1228897459.00,United States,,4974586,Health Care,Major Pharmaceuticals
LYFT,Lyft Inc. Class A Common Stock,$53.41,0.29,0.546%,16958905032.00,United States,2019,5460084,Miscellaneous,Business Services
LYL,Dragon Victory International Limited Ordinary Shares,$2.84,-0.25,-8.091%,32436756.00,China,2017,298765,Finance,Finance/Investors Services
LYRA,Lyra Therapeutics Inc. Common Stock,$10.63,-0.05,-0.468%,137413659.00,United States,2020,39933,Health Care,Medical/Dental Instruments
LYTS,LSI Industries Inc. Common Stock,$10.09,0.05,0.498%,266736405.00,United States,1985,168273,Consumer Durables,Building Products
MAAC,Montes Archimedes Acquisition Corp. Class A Common Stock,$10.30,-0.02,-0.194%,0.00,United States,2020,126794,Finance,Business Services
MAACU,Montes Archimedes Acquisition Corp. Unit,$11.20,0.20,1.818%,0.00,United States,2020,101607,Finance,Business Services
MAACW,Montes Archimedes Acquisition Corp. Warrant,$1.83,-0.02,-1.081%,0.00,United States,2020,152911,Finance,Business Services
MACK,Merrimack Pharmaceuticals Inc. Common Stock,$7.75,0.31,4.167%,103696883.00,United States,2012,45788,Health Care,Major Pharmaceuticals
MACU,Mallard Acquisition Corp. Common stock,$10.25,-0.01,-0.097%,145165625.00,United States,2020,2094,Finance,Business Services
MACUU,Mallard Acquisition Corp. Unit,$10.82,0.00,0.00%,0.00,United States,2020,28,Finance,Business Services
MACUW,Mallard Acquisition Corp. Warrant,$0.8794,-0.0091,-1.024%,0.00,United States,2020,29617,Finance,Business Services
MAGS,Magal Security Systems Ltd. Ordinary Shares,$5.23,-0.02,-0.381%,121095342.00,Israel,1993,173050,Capital Goods,Telecommunications Equipment
MANH,Manhattan Associates Inc. Common Stock,$134.49,4.03,3.089%,8543665267.00,United States,1998,386151,Technology,Computer Software: Prepackaged Software
MANT,ManTech International Corporation Common Stock $0.01 Par Value,$89.76,0.99,1.115%,3622373589.00,United States,2002,182195,Consumer Services,Other Consumer Services
MAR,Marriott International Class A Common Stock,$129.09,-0.39,-0.301%,41867981218.00,United States,,2187823,Consumer Services,Hotels/Resorts
MARA,Marathon Patent Group Inc. Common Stock,$32.07,9.55,42.407%,3011654895.00,United States,,70494411,Technology,EDP Services
MARK,Remark Holdings Inc. Common Stock,$4.42,0.14,3.271%,439812281.00,United States,,4014724,Consumer Services,Telecommunications Equipment
MARPS,Marine Petroleum Trust Units of Beneficial Interest,$5.81,0.23,4.122%,11620000.00,United States,,219167,Energy,Oil & Gas Production
MASI,Masimo Corporation Common Stock,$261.82,1.53,0.588%,14414557439.00,United States,2007,284512,Health Care,Biotechnology: Electromedical & Electrotherapeutic Apparatus
MASS,908 Devices Inc. Common Stock,$71.52,3.52,5.176%,1873878498.00,United States,2020,323664,Capital Goods,Industrial Machinery/Components
MAT,Mattel Inc. Common Stock,$18.46,-0.05,-0.27%,6424824012.00,United States,,3171709,Consumer Non-Durables,Recreational Products/Toys
MATW,Matthews International Corporation Class A Common Stock,$33.70,0.71,2.152%,1067437255.00,United States,1994,142695,Capital Goods,Metal Fabrications
MAXN,Maxeon Solar Technologies Ltd. Ordinary Shares,$50.58,3.79,8.10%,1694293333.00,Singapore,,570535,Technology,Semiconductors
MAYS,J. W. Mays Inc. Common Stock,$28.45,0.00,0.00%,57348941.00,United States,,38,Consumer Services,Building operators
MBCN,Middlefield Banc Corp. Common Stock,$23.18,0.50,2.205%,147844590.00,United States,,14453,Finance,Major Banks
MBII,Marrone Bio Innovations Inc. Common Stock,$2.70,0.35,14.894%,403310472.00,United States,2013,2975946,Basic Industries,Agricultural Chemicals
MBIN,Merchants Bancorp Common Stock,$32.67,0.37,1.146%,939167202.00,United States,2017,113689,Finance,Major Banks
MBINO,Merchants Bancorp Depositary Shares Each Representing a 1/40th Interest in a Share of Series B  Fixed-to-Floating Rate,$26.2187,-0.0313,-0.119%,0.00,United States,,4318,Finance,Major Banks
MBINP,Merchants Bancorp 7.00% Fixed-to-Floating Rate Series A Non-Cumulative Perpetual Preferred Stock,$26.8956,0.1856,0.695%,0.00,United States,,1700,Finance,Major Banks
MBIO,Mustang Bio Inc. Common Stock,$4.775,0.105,2.248%,313208724.00,United States,,2695578,Health Care,Major Pharmaceuticals
MBNKP,Medallion Bank Fixed-to-Floating Rate Non-Cumulative Perpetual Preferred Stock Series F,$24.05,-1.13,-4.488%,0.00,United States,2019,10455,,
MBOT,Microbot Medical Inc. Common Stock,$9.49,0.44,4.862%,67456182.00,Israel,,226921,Health Care,Biotechnology: Biological Products (No Diagnostic Substances)
MBRX,Moleculin Biotech Inc. Common Stock,$4.91,0.11,2.292%,58920118.00,United States,2016,5118967,Health Care,Major Pharmaceuticals
MBUU,Malibu Boats Inc. Class A Common Stock,$78.68,3.48,4.628%,1630304361.00,United States,2014,320977,Capital Goods,Marine Transportation
MBWM,Mercantile Bank Corporation Common Stock,$28.74,-0.18,-0.622%,469337880.00,United States,1998,59191,Finance,Major Banks
MCAC,Mountain Crest Acquisition Corp. Common Stock,$13.92,1.27,10.04%,104991475.00,United States,2020,802251,Consumer Services,Other Specialty Stores
MCACR,Mountain Crest Acquisition Corp. Right,$1.36,0.11,8.80%,0.00,United States,2020,91415,Consumer Services,Other Specialty Stores
MCACU,Mountain Crest Acquisition Corp Unit,$15.8523,3.2523,25.812%,0.00,United States,2020,5559,Consumer Services,Other Specialty Stores
MCADU,Mountain Crest Acquisition Corp. II Unit,$10.52,0.00,0.00%,0.00,United States,2021,11460,Finance,Business Services
MCBC,Macatawa Bank Corporation Common Stock,$8.70,0.13,1.517%,296681484.00,United States,,64564,Finance,Major Banks
MCBS,MetroCity Bankshares Inc. Common Stock,$14.85,-0.05,-0.336%,381259895.00,United States,2019,22678,Finance,Major Banks
MCFE,McAfee Corp. Class A Common Stock,$20.27,-0.30,-1.458%,8602387672.00,United States,2020,383593,Technology,Computer Software: Prepackaged Software
MCFT,MasterCraft Boat Holdings Inc. Common Stock,$28.82,1.29,4.686%,546206381.00,United States,2015,221463,Capital Goods,Marine Transportation
MCHP,Microchip Technology Incorporated Common Stock,$152.47,7.03,4.834%,41054379122.00,United States,1993,2477502,Technology,Semiconductors
MCHX,Marchex Inc. Class B Common Stock,$3.09,0.10,3.344%,122273188.00,United States,2004,155830,Miscellaneous,Business Services
MCMJ,Merida Merger Corp. I Common Stock,$10.7299,0.0299,0.279%,175669279.00,United States,2019,157718,Finance,Business Services
MCMJW,Merida Merger Corp. I Warrant,$2.17,0.23,11.856%,0.00,United States,2019,77532,Finance,Business Services
MCRB,Seres Therapeutics Inc. Common Stock,$28.92,1.88,6.953%,2638899043.00,United States,2015,1352909,Health Care,Major Pharmaceuticals
MCRI,Monarch Casino & Resort Inc. Common Stock,$57.75,0.23,0.40%,1054711639.00,United States,1993,63087,Consumer Services,Hotels/Resorts
MDB,MongoDB Inc. Class A Common Stock,$410.78,-1.88,-0.456%,24756198108.00,United States,2017,339278,Technology,Computer Software: Prepackaged Software
MDCA,MDC Partners Inc. CL A Subordinate Voting Shares,$3.25,0.01,0.309%,238978506.00,Canada,,131691,Technology,Advertising
MDGL,Madrigal Pharmaceuticals Inc. Common Stock,$124.52,4.02,3.336%,1922355200.00,United States,,281423,Health Care,Major Pharmaceuticals
