Symbol,Name,Last Sale,Net Change,% Change,Market Cap,Country,IPO Year,Volume,Sector,Industry
PRIM,Primoris Services Corporation Common Stock,$32.39,0.55,1.727%,1557839740.00,United States,,236006,Basic Industries,Water Supply
PRLD,Prelude Therapeutics Incorporated Common Stock,$85.78,1.57,1.864%,3995493522.00,United States,2020,147740,Health Care,Major Pharmaceuticals
PROF,Profound Medical Corp. Common Stock,$27.90,-0.19,-0.676%,547564117.00,Canada,,69977,Health Care,Medical/Dental Instruments
PROG,Progenity Inc. Common Stock,$5.79,-0.42,-6.763%,316399929.00,United States,2020,1477236,Health Care,Medical Specialities
PROV,Provident Financial Holdings Inc. Common Stock,$15.73,0.33,2.143%,117066655.00,United States,,6200,Finance,Savings Institutions
PRPH,ProPhase Labs Inc. Common Stock (DE),$10.83,0.23,2.17%,164120560.00,United States,,114585,Health Care,Major Pharmaceuticals
PRPL,Purple Innovation Inc. Common Stock,$39.77,1.73,4.548%,2562977650.00,United States,2015,1003355,Consumer Durables,Home Furnishings
PRPO,Precipio Inc.  Common Stock,$3.28,0.19,6.149%,56504284.00,United States,,1831913,Capital Goods,Biotechnology: Laboratory Analytical Instruments
PRQR,ProQR Therapeutics N.V. Ordinary Shares,$5.35,0.35,7.00%,268282191.00,Netherlands,2014,979355,Health Care,Major Pharmaceuticals
PRSRU,Prospector Capital Corp. Unit,$11.20,0.01,0.089%,0.00,United States,2021,156661,Finance,Business Services
PRTA,Prothena Corporation plc Ordinary Shares,$15.52,1.00,6.887%,619580330.00,United States,,430332,Health Care,Major Pharmaceuticals
PRTC,PureTech Health plc American Depositary Shares,$53.53,0.00,0.00%,1530415955.00,United Kingdom,,303,Health Care,Major Pharmaceuticals
PRTH,Priority Technology Holdings Inc. Common Stock,$7.52,-0.36,-4.569%,505490858.00,United States,2016,61351,Miscellaneous,Business Services
PRTK,Paratek Pharmaceuticals Inc. Common Stock,$8.31,0.45,5.725%,379278422.00,United States,,634254,Health Care,Major Pharmaceuticals
PRTS,CarParts.com Inc. Common Stock,$20.63,1.51,7.897%,976223277.00,United States,2007,4780709,Consumer Services,Other Specialty Stores
PRVB,Provention Bio Inc. Common Stock,$15.23,0.40,2.697%,955498080.00,United States,2018,985452,Health Care,Major Pharmaceuticals
PS,Pluralsight Inc. Class A Common Stock,$21.22,-0.02,-0.094%,3169458054.00,United States,2018,2739223,Technology,Computer Software: Programming Data Processing
PSAC,Property Solutions Acquisition Corp. Common Stock,$17.49,0.23,1.333%,516243777.00,United States,2020,2295290,Finance,Business Services
PSACU,Property Solutions Acquisition Corp. Unit,$21.85,0.26,1.204%,0.00,United States,2020,135218,Finance,Business Services
PSACW,Property Solutions Acquisition Corp. Warrant,$4.45,0.33,8.01%,0.00,United States,2020,963742,Finance,Business Services
PSEC,Prospect Capital Corporation Common Stock,$6.72,-0.12,-1.754%,2557581889.00,United States,2004,3370076,,
PSHG,Performance Shipping Inc. Common Shares,$6.41,0.56,9.573%,32580274.00,Greece,,156111,Transportation,Marine Transportation
PSMT,PriceSmart Inc. Common Stock,$101.83,2.43,2.445%,3130084551.00,United States,,124988,Consumer Services,Department/Specialty Retail Stores
PSNL,Personalis Inc. Common Stock,$41.32,0.29,0.707%,1608703503.00,United States,2019,774405,Health Care,Medical Specialities
PSTI,Pluristem Therapeutics Inc. Common Stock,$7.74,0.96,14.159%,207179382.00,Israel,,2215355,Health Care,Biotechnology: Biological Products (No Diagnostic Substances)
PSTV,PLUS THERAPEUTICS Inc. Common Stock ,$3.04,0.29,10.545%,14529935.00,United States,,930256,Health Care,Medical/Dental Instruments
PSTX,Poseida Therapeutics Inc. Common Stock,$9.24,0.24,2.667%,571216892.00,United States,2020,459061,Health Care,Biotechnology: Biological Products (No Diagnostic Substances)
PT,Pintec Technology Holdings Limited American Depositary Shares,$1.44,0.05,3.597%,62119089.00,China,2018,974833,Technology,Computer Software: Programming Data Processing
PTC,PTC Inc. Common Stock,$142.92,0.19,0.133%,16694544941.00,United States,,617925,Technology,Computer Software: Prepackaged Software
PTCT,PTC Therapeutics Inc. Common Stock,$63.94,0.39,0.614%,4362993152.00,United States,2013,396745,Health Care,Major Pharmaceuticals
PTE,PolarityTE Inc. Common Stock,$1.29,0.13,11.207%,86175640.00,United States,,12710717,Health Care,Biotechnology: Biological Products (No Diagnostic Substances)
PTEN,Patterson-UTI Energy Inc. Common Stock,$6.41,0.17,2.724%,1201835098.00,United States,1993,2309260,Energy,Oil & Gas Production
PTGX,Protagonist Therapeutics Inc. Common Stock,$24.64,2.26,10.098%,1059980669.00,United States,2016,261207,Health Care,Major Pharmaceuticals
PTIC,PropTech Investment Corporation II Class A Common Stock,$10.35,-0.09,-0.862%,0.00,United States,2021,56979,Finance,Business Services
PTICU,PropTech Investment Corporation II Unit,$10.88,-0.07,-0.639%,0.00,United States,2020,188379,Finance,Business Services
PTICW,PropTech Investment Corporation II Warrant,$2.30,0.38,19.792%,0.00,United States,2021,36245,Finance,Business Services
PTMN,Portman Ridge Finance Corporation Common Stock,$2.00,0.01,0.503%,140328460.00,United States,,270366,,
PTNR,Partner Communications Company Ltd. American Depositary Shares,$4.55,0.065,1.449%,835932211.00,Israel,,5070,Public Utilities,Telecommunications Equipment
PTON,Peloton Interactive Inc. Class A Common Stock,$144.99,-3.31,-2.232%,42699796408.00,United States,2019,11373638,Energy,Consumer Electronics/Appliances
PTPI,Petros Pharmaceuticals Inc. Common Stock,$4.13,0.24,6.17%,40343174.00,United States,,163189,Health Care,Major Pharmaceuticals
PTRS,Partners Bancorp Common Stock,$6.73,-0.12,-1.752%,119862733.00,United States,,7050,Finance,Major Banks
PTSI,P.A.M. Transportation Services Inc. Common Stock,$58.00,2.26,4.055%,332601696.00,United States,1986,3726,Transportation,Trucking Freight/Courier Services
PTVCA,Protective Insurance Corporation Class A Common Stock,$15.38,0.00,0.00%,219409034.00,United States,,96,Finance,Property-Casualty Insurers
PTVCB,Protective Insurance Corporation Class B Common Stock,$15.12,0.64,4.42%,215699909.00,United States,,25714,Finance,Property-Casualty Insurers
PTVE,Pactiv Evergreen Inc. Common stock,$15.37,0.59,3.992%,2722914003.00,United States,2020,1539443,Consumer Durables,Containers/Packaging
PUBM,PubMatic Inc. Class A Common Stock,$50.13,-5.34,-9.627%,2397542646.00,United States,2020,690236,Technology,Computer Software: Programming Data Processing
PULM,Pulmatrix Inc. Common Stock,$1.84,0.20,12.195%,63309769.00,United States,2014,2364078,Health Care,Major Pharmaceuticals
PUYI,Puyi Inc. American Depository Shares,$6.05,-0.10,-1.626%,364903790.00,China,2019,1437,Finance,Investment Managers
PVAC,Penn Virginia Corporation Common Stock,$12.39,1.18,10.526%,468550090.00,United States,,726235,Energy,Oil & Gas Production
PVBC,Provident Bancorp Inc. (MD) Common Stock,$12.34,0.24,1.983%,235046693.00,United States,2015,26571,Finance,Savings Institutions
PWFL,PowerFleet Inc. Common Stock,$8.26,0.58,7.552%,288694797.00,United States,,288199,Capital Goods,Telecommunications Equipment
PWOD,Penns Woods Bancorp Inc. Common Stock,$23.79,0.82,3.57%,167775430.00,United States,,14949,Finance,Major Banks
PXLW,Pixelworks Inc.  Common Stock,$3.71,0.21,6.00%,188732163.00,United States,2000,605172,Technology,Semiconductors
PXS,Pyxis Tankers Inc. Common Stock,$1.26,0.11,9.565%,27165455.00,Greece,,1262355,Transportation,Marine Transportation
PXSAP,Pyxis Tankers Inc. 7.75% Series A Cumulative Convertible Preferred Shares,$19.15,1.9543,11.365%,0.00,Greece,,1908,Transportation,Marine Transportation
PXSAW,Pyxis Tankers Inc. Warrant,$0.329,0.044,15.439%,0.00,Greece,,117526,Transportation,Marine Transportation
PYPD,PolyPid Ltd. Ordinary Shares,$11.11,1.20,12.109%,205472162.00,Israel,2020,195205,Health Care,Medical/Dental Instruments
PYPL,PayPal Holdings Inc. Common Stock,$282.17,12.73,4.725%,330470664199.00,United States,,10065000,Miscellaneous,Business Services
PZZA,Papa John's International Inc. Common Stock,$100.26,-1.54,-1.513%,3303785968.00,United States,1993,609603,Consumer Services,Restaurants
QADA,QAD Inc. Class A Common Stock,$74.04,3.86,5.50%,1532559661.00,United States,,43521,Technology,Computer Software: Prepackaged Software
QADB,QAD Inc. Class B Common Stock,$51.25,1.45,2.912%,1060827696.00,United States,,1963,Technology,Computer Software: Prepackaged Software
QCOM,QUALCOMM Incorporated Common Stock,$147.38,1.54,1.056%,167423680000.00,United States,1991,12161267,Technology,Radio And Television Broadcasting And Communications Equipment
QCRH,QCR Holdings Inc. Common Stock,$41.87,0.59,1.429%,661267858.00,United States,,164576,Finance,Major Banks
QDEL,Quidel Corporation Common Stock,$232.88,-4.12,-1.738%,9796713400.00,United States,,1305905,Health Care,Biotechnology: In Vitro & In Vivo Diagnostic Substances
QELL,Qell Acquisition Corp. Class A Ordinary Shares,$14.27,0.30,2.147%,676933125.00,United States,2020,1566190,Finance,Business Services
QELLU,Qell Acquisition Corp. Unit,$15.54,0.31,2.035%,0.00,United States,2020,137645,Finance,Business Services
QELLW,Qell Acquisition Corp. Warrant,$4.00,0.14,3.627%,0.00,United States,2020,382045,Finance,Business Services
QFIN,360 DigiTech Inc. American Depositary Shares,$20.46,0.55,2.762%,3112202272.00,China,2018,3381634,Finance,Finance: Consumer Services
QH,Quhuo Limited American Depository Shares,$8.00,-0.58,-6.76%,415251280.00,China,2020,146218,Miscellaneous,Business Services
QIWI,QIWI plc American Depositary Shares,$10.98,0.55,5.273%,688588466.00,Cyprus,2013,950454,Miscellaneous,Business Services
QK,Q&K International Group Limited American Depositary Shares,$3.87,0.55,16.566%,209797851.00,China,2019,412298,Finance,Real Estate
QLGN,Qualigen Therapeutics Inc. Common Stock,$4.23,0.24,6.015%,112970817.00,United States,2015,4017855,Health Care,Major Pharmaceuticals
QLI,Qilian International Holding Group Ltd. Ordinary Shares,$7.12,0.02,0.282%,249200000.00,China,2021,560952,Health Care,Major Pharmaceuticals
QLYS,Qualys Inc. Common Stock,$126.79,2.15,1.725%,4946913573.00,United States,2012,387303,Technology,Computer Software: Prepackaged Software
QMCO,Quantum Corporation Common Stock,$8.68,0.63,7.826%,353625040.00,United States,,986308,Technology,Electronic Components
QNST,QuinStreet Inc. Common Stock,$24.04,-0.04,-0.166%,1271554427.00,United States,2010,370634,Miscellaneous,Business Services
QQQX,Nuveen NASDAQ 100 Dynamic Overwrite Fund Shares of Beneficial Interest,$26.93,0.19,0.711%,1102963258.00,United States,,169246,,
QRHC,Quest Resource Holding Corporation Common Stock,$2.88,0.07,2.491%,52937934.00,United States,,36008,Technology,Diversified Commercial Services
QRTEA,Qurate Retail Inc. Series A Common Stock ,$13.32,0.20,1.524%,5557390233.00,United States,,2338858,Consumer Services,Catalog/Specialty Distribution
QRTEB,Qurate Retail Inc. Series B Common Stock ,$13.32,0.14,1.062%,5557390233.00,United States,,6799,Consumer Services,Catalog/Specialty Distribution
QRTEP,Qurate Retail Inc. 8.0% Fixed Rate Cumulative Redeemable Preferred Stock,$101.03,0.18,0.178%,0.00,United States,,38132,Consumer Services,Catalog/Specialty Distribution
QRVO,Qorvo Inc. Common Stock,$170.76,3.62,2.166%,19340739847.00,United States,,1654878,Technology,Semiconductors
QTNT,Quotient Limited Ordinary Shares,$5.20,-0.09,-1.701%,525892916.00,Switzerland,2014,1300309,Health Care,Biotechnology: In Vitro & In Vivo Diagnostic Substances
QTRX,Quanterix Corporation Common Stock,$77.79,-2.01,-2.519%,2476548811.00,United States,2017,431497,Capital Goods,Biotechnology: Laboratory Analytical Instruments
QTT,Qutoutiao Inc. American Depositary Shares,$3.76,0.02,0.535%,1003265956.00,China,2018,5403484,Technology,Computer Software: Programming Data Processing
QUIK,QuickLogic Corporation Common Stock,$4.21,-0.09,-2.093%,46598297.00,United States,1999,99971,Technology,Semiconductors
QUMU,Qumu Corporation Common Stock,$10.31,1.11,12.065%,180838214.00,United States,,367468,Technology,Computer Software: Prepackaged Software
QURE,uniQure N.V. Ordinary Shares,$38.75,2.75,7.639%,1724225464.00,Netherlands,2014,992590,Health Care,Major Pharmaceuticals
RAACU,Revolution Acceleration Acquisition Corp Unit,$11.00,0.03,0.273%,0.00,United States,2020,450398,Finance,Business Services
RACA,Therapeutics Acquisition Corp. Class A Common Stock,$13.98,0.08,0.576%,243725922.00,United States,2020,52661,Finance,Business Services
RADA,RADA Electronic Industries Ltd. Ordinary Shares,$12.67,1.31,11.532%,550955774.00,Israel,,1148236,Technology,Electronic Components
RADI,Radius Global Infrastructure Inc. Class A Common Stock,$13.17,0.19,1.464%,769457250.00,United States,,90543,Consumer Services,Real Estate
RAIL,FreightCar America Inc. Common Stock,$4.48,0.25,5.91%,69596034.00,United States,2005,388369,Capital Goods,Railroads
RAND,Rand Capital Corporation Common Stock,$15.60,-0.40,-2.50%,40306843.00,United States,,3109,Finance,Finance: Consumer Services
RAPT,RAPT Therapeutics Inc. Common Stock,$21.53,0.80,3.859%,528674726.00,United States,2019,123922,Health Care,Major Pharmaceuticals
RARE,Ultragenyx Pharmaceutical Inc. Common Stock,$165.84,3.62,2.232%,10971277540.00,United States,2014,447813,Health Care,Major Pharmaceuticals
RAVE,Rave Restaurant Group Inc. Common Stock,$1.29,0.06,4.878%,23226326.00,United States,,883858,Consumer Non-Durables,Food Distributors
RAVN,Raven Industries Inc. Common Stock,$37.56,1.80,5.034%,1346668165.00,United States,,211504,Capital Goods,Specialty Chemicals
RBB,RBB Bancorp Common Stock,$18.24,0.51,2.876%,356882399.00,United States,2017,26816,Finance,Major Banks
RBBN,Ribbon Communications Inc. Common Stock,$10.61,1.75,19.752%,1542658255.00,United States,,2911687,Technology,EDP Services
RBCAA,Republic Bancorp Inc. Class A Common Stock,$41.39,2.14,5.452%,865509353.00,United States,1998,27960,Finance,Major Banks
RBCN,Rubicon Technology Inc. Common Stock,$10.68,0.73,7.337%,25865059.00,United States,2007,21824,Technology,Semiconductors
RBKB,Rhinebeck Bancorp Inc. Common Stock,$9.3669,0.1569,1.704%,104284414.00,United States,2019,521,Finance,Banks
RBNC,Reliant Bancorp Inc. Common Stock,$21.33,0.49,2.351%,355238544.00,United States,,33782,Finance,Major Banks
RCEL,Avita Therapeutics Inc. Common Stock,$27.38,0.06,0.22%,592045598.00,Australia,,96413,Health Care,Medical/Dental Instruments
RCHG,Recharge Acquisition Corp. Class A Common Stock,$10.24,-0.05,-0.486%,263680000.00,United States,2020,296420,Finance,Business Services
RCHGU,Recharge Acquisition Corp. Unit,$11.00,0.10,0.917%,0.00,United States,2020,35051,Finance,Business Services
RCHGW,Recharge Acquisition Corp. Warrant,$1.45,-0.0301,-2.034%,0.00,United States,2020,201885,Finance,Business Services
RCII,Rent-A-Center Inc. Common Stock,$52.68,3.07,6.188%,2855558910.00,United States,1995,737113,Technology,Diversified Commercial Services
RCKT,Rocket Pharmaceuticals Inc. Common Stock,$65.91,1.74,2.712%,3992371966.00,United States,2015,389588,Health Care,Major Pharmaceuticals
RCKY,Rocky Brands Inc. Common Stock,$36.63,0.13,0.356%,265290248.00,United States,1993,25183,Consumer Non-Durables,Shoe Manufacturing
RCM,R1 RCM Inc. Common Stock,$28.39,0.47,1.683%,7392449388.00,United States,,1425447,Consumer Services,Other Consumer Services
RCMT,RCM Technologies Inc. Common Stock,$3.01,0.04,1.347%,35981329.00,United States,,68621,Technology,Professional Services
RCON,Recon Technology Ltd. Ordinary Shares,$2.69,0.29,12.083%,19375618.00,China,2009,9894224,Energy,Oilfield Services/Equipment
RDCM,Radcom Ltd. Ordinary Shares,$10.87,0.26,2.451%,151567541.00,Israel,1997,16228,Technology,Computer peripheral equipment
RDFN,Redfin Corporation Common Stock,$88.67,5.97,7.219%,9074843455.00,United States,2017,1535078,Finance,Real Estate
RDHL,Redhill Biopharma Ltd. American Depositary Shares,$9.14,0.41,4.696%,380104467.00,Israel,,654322,Health Care,Major Pharmaceuticals
RDI,Reading International Inc Class A Common Stock,$6.69,0.45,7.212%,145502128.00,United States,,64631,Consumer Services,Movies/Entertainment
RDIB,Reading International Inc Class B Common Stock,$20.2988,-0.7012,-3.339%,441482600.00,United States,,359,Consumer Services,Movies/Entertainment
RDNT,RadNet Inc. Common Stock,$19.08,-0.16,-0.832%,985216769.00,United States,,204163,Health Care,Medical Specialities
RDUS,Radius Health Inc. Common Stock,$23.52,0.58,2.528%,1094794542.00,United States,2014,332892,Health Care,Major Pharmaceuticals
RDVT,Red Violet Inc. Common Stock ,$25.95,1.07,4.301%,315293408.00,United States,,54706,Technology,Computer Software: Prepackaged Software
RDWR,Radware Ltd. Ordinary Shares,$29.40,0.30,1.031%,1357109233.00,Israel,1999,179815,Miscellaneous,Business Services
REAL,The RealReal Inc. Common Stock,$24.30,0.24,0.998%,2152430990.00,United States,2019,1771965,Consumer Services,Other Specialty Stores
REDU,RISE Education Cayman Ltd American Depositary Shares,$5.72,-0.21,-3.541%,322483081.00,China,2017,60411,Consumer Services,Other Consumer Services
REED,Reeds Inc. Common Stock,$1.10,0.04,3.774%,91851756.00,United States,,1514041,Consumer Non-Durables,Beverages (Production/Distribution)
REFR,Research Frontiers Incorporated Common Stock,$5.00,-0.27,-5.123%,157878930.00,United States,,546185,Miscellaneous,Multi-Sector Companies
REG,Regency Centers Corporation Common Stock,$48.96,-0.15,-0.305%,8307539263.00,United States,1993,1106787,Consumer Services,Real Estate Investment Trusts
REGI,Renewable Energy Group Inc. Common Stock,$111.49,12.81,12.981%,4385204841.00,United States,2012,1421503,Basic Industries,Major Chemicals
REGN,Regeneron Pharmaceuticals Inc. Common Stock,$494.90,-4.08,-0.818%,52808930054.00,United States,1991,1317589,Health Care,Major Pharmaceuticals
REKR,Rekor Systems Inc. Common Stock,$16.82,0.78,4.863%,554627003.00,United States,,1547277,Capital Goods,Telecommunications Equipment
RELI,Reliance Global Group Inc. Common Stock,$0.3905,0.2155,123.143%,,United States,,11351998,,
RELL,Richardson Electronics Ltd. Common Stock,$6.37,0.30,4.942%,84132756.00,United States,1983,41956,Technology,Electronic Components
REPH,Recro Pharma Inc. Common Stock,$3.90,0.25,6.849%,92214061.00,United States,2014,1004898,Health Care,Major Pharmaceuticals
REPL,Replimune Group Inc. Common Stock,$42.92,-0.47,-1.083%,1995499604.00,United States,2018,385942,Health Care,Biotechnology: Biological Products (No Diagnostic Substances)
RESN,Resonant Inc. Common Stock,$7.50,0.09,1.215%,406321253.00,United States,2014,2568023,Technology,Semiconductors
RETA,Reata Pharmaceuticals Inc. Class A Common Stock,$113.58,-1.37,-1.192%,4102026999.00,United States,2016,281168,Health Care,Major Pharmaceuticals
RETO,ReTo Eco-Solutions Inc. Common Shares,$1.11,0.02,1.835%,26789850.00,China,2017,603764,Capital Goods,Industrial Machinery/Components
REYN,Reynolds Consumer Products Inc. Common Stock,$30.15,0.09,0.299%,6322470075.00,United States,2020,757105,Consumer Durables,Containers/Packaging
RFIL,RF Industries Ltd. Common Stock,$6.21,0.04,0.648%,61157608.00,United States,,46007,Capital Goods,Electrical Products
RGCO,RGC Resources Inc. Common Stock,$23.41,0.23,0.992%,191276110.00,United States,,12592,Public Utilities,Oil & Gas Production
RGEN,Repligen Corporation Common Stock,$219.14,-2.92,-1.315%,11990740576.00,United States,1986,304335,Health Care,Biotechnology: Biological Products (No Diagnostic Substances)
RGLD,Royal Gold Inc. Common Stock,$109.36,3.67,3.472%,7174726403.00,United States,,577309,Basic Industries,Precious Metals
RGLS,Regulus Therapeutics Inc. Common Stock,$1.65,0.12,7.843%,110386587.00,United States,2012,1781488,Health Care,Major Pharmaceuticals
RGNX,REGENXBIO Inc. Common Stock,$48.75,2.42,5.223%,2062488090.00,United States,2015,399203,Health Care,Biotechnology: Biological Products (No Diagnostic Substances)
RGP,Resources Connection Inc. Common Stock,$12.74,0.27,2.165%,414155806.00,United States,,184920,Miscellaneous,Business Services
RIBT,RiceBran Technologies Common Stock,$1.10,0.05,4.762%,46169853.00,United States,,310765,Consumer Non-Durables,Packaged Foods
RICK,RCI Hospitality Holdings Inc. Common Stock,$46.33,-1.65,-3.439%,416965830.00,United States,1995,37966,Consumer Services,Restaurants
RIDE,Lordstown Motors Corp. Class A Common Stock,$27.40,0.63,2.353%,4519600490.00,United States,2019,4330054,Capital Goods,Auto Manufacturing
RIGL,Rigel Pharmaceuticals Inc. Common Stock,$4.93,0.27,5.794%,833078470.00,United States,2000,4888759,Health Care,Major Pharmaceuticals
RILY,B. Riley Financial Inc. Common Stock,$54.64,0.79,1.467%,1466790037.00,United States,,168405,Miscellaneous,Business Services
RILYG,B. Riley Financial Inc. 7.25% Senior Notes due 2027,$25.22,-0.02,-0.079%,0.00,United States,,7107,Miscellaneous,Business Services
RILYH,B. Riley Financial Inc. 7.375% Senior Notes due 2023,$25.6916,0.0415,0.162%,0.00,United States,,2008,Miscellaneous,Business Services
RILYI,B. Riley Financial Inc. 6.875% Senior Notes due 2023,$25.41,-0.02,-0.079%,0.00,United States,,787,Miscellaneous,Business Services
RILYL,B. Riley Financial Inc. Depositary Shares each representing 1/1000th in a share of 7.375% Series B Cumulative Perpetual Preferred Stock par value $0.0001,$26.89,0.24,0.901%,0.00,United States,,2619,Miscellaneous,Business Services
RILYM,B. Riley Financial Inc. 6.375% Senior Notes due 2025,$25.30,0.05,0.198%,0.00,United States,,6952,Miscellaneous,Business Services
RILYN,B. Riley Financial Inc. 6.50% Senior Notes Due 2026,$25.60,-0.02,-0.078%,0.00,United States,,15828,Miscellaneous,Business Services
RILYO,B. Riley Financial Inc. 6.75% Senior Notes due 2024,$25.4001,-0.1099,-0.431%,0.00,United States,,14392,Miscellaneous,Business Services
RILYP,B. Riley Financial Inc. Depositary Shares each representing a 1/1000th fractional interest in a share of Series A Cumulative Perpetual Preferred Stock,$26.33,-0.03,-0.114%,0.00,United States,,5229,Miscellaneous,Business Services
RILYT,B. Riley Financial Inc. 6.00% Senior Notes Due 2028,$25.2505,-0.0495,-0.196%,0.00,United States,,25468,Miscellaneous,Business Services
RILYZ,B. Riley Financial Inc. 7.50% Senior Notes Due 2027,$25.16,-0.02,-0.079%,0.00,United States,,18773,Miscellaneous,Business Services
RIOT,Riot Blockchain Inc.  Common Stock ,$32.79,9.41,40.248%,2214305651.00,United States,,50897751,Technology,EDP Services
RIVE,Riverview Financial Corporation Common Stock,$9.88,0.08,0.816%,91947647.00,United States,,1092,Finance,Major Banks
RKDA,Arcadia Biosciences Inc. Common Stock,$3.58,0.38,11.875%,76352969.00,United States,2015,2060307,Consumer Non-Durables,Farming/Seeds/Milling
RLAY,Relay Therapeutics Inc. Common Stock,$50.00,0.61,1.235%,4499238750.00,United States,2020,815578,Health Care,Biotechnology: Biological Products (No Diagnostic Substances)
RLMD,Relmada Therapeutics Inc. Common Stock,$35.00,1.16,3.428%,568453410.00,United States,,209053,Health Care,Major Pharmaceuticals
RMBI,Richmond Mutual Bancorporation Inc. Common Stock,$13.08,0.04,0.307%,172043778.00,United States,2019,27829,Finance,Major Banks
RMBL,RumbleOn Inc. Class B Common Stock,$53.00,4.50,9.278%,118806549.00,United States,,38305,Technology,EDP Services
RMBS,Rambus Inc. Common Stock,$20.12,0.57,2.916%,2273560000.00,United States,1997,534842,Technology,Semiconductors
RMCF,Rocky Mountain Chocolate Factory Inc. Common Stock,$5.90,-0.03,-0.506%,35838329.00,United States,,384936,Consumer Non-Durables,Specialty Foods
RMGB,RMG Acquisition Corp. II Class A Ordinary Shares,$11.51,-0.52,-4.323%,496368750.00,United States,2021,324871,Finance,Business Services
RMGBU,RMG Acquisition Corp. II Unit,$12.38,-0.40,-3.13%,0.00,United States,2020,435467,Finance,Business Services
RMGBW,RMG Acquisition Corp. II Warrant,$2.90,-0.084,-2.815%,0.00,United States,2021,120175,Finance,Business Services
RMGCU,RMG Acquisition Corp. III Unit,$10.99,0.10,0.918%,0.00,United States,2021,3079232,,
RMNI,Rimini Street Inc. (DE) Common Stock,$8.53,0.63,7.975%,650711050.00,United States,2015,566813,Miscellaneous,Business Services
RMR,The RMR Group Inc. Class A Common Stock,$40.02,1.63,4.246%,1256453553.00,United States,,25486,Consumer Services,Professional Services
RMRM,RMR Mortgage Trust Common Stock,$11.99,0.83,7.437%,122322088.00,United States,,239590,,
RMTI,Rockwell Medical Inc. (DE) Common Stock,$1.48,0.11,8.029%,138488284.00,United States,1998,4312300,Health Care,Major Pharmaceuticals
RNA,Avidity Biosciences Inc. Common Stock,$23.48,1.04,4.635%,881125296.00,United States,2020,260515,Health Care,Major Pharmaceuticals
RNDB,Randolph Bancorp Inc. Common Stock,$19.70,-0.30,-1.50%,108813383.00,United States,2016,24356,Finance,Major Banks
RNET,RigNet Inc. Common Stock,$10.42,0.63,6.435%,218935756.00,United States,2010,274499,Consumer Services,Telecommunications Equipment
RNLX,Renalytix AI plc American Depositary Shares,$25.70,0.04,0.156%,925580797.00,United Kingdom,2020,130625,Health Care,Medical Specialities
RNST,Renasant Corporation Common Stock,$38.20,1.04,2.799%,2146858603.00,United States,,312263,Finance,Major Banks
RNWK,RealNetworks Inc. Common Stock,$2.85,-0.12,-4.04%,109086207.00,United States,1997,874633,Technology,EDP Services
ROAD,Construction Partners Inc. Class A Common Stock,$28.48,-0.69,-2.365%,1475028898.00,United States,2018,557806,Basic Industries,Military/Government/Technical
ROCC,Roth CH Acquisition II Co. Common Stock,$10.73,0.05,0.468%,157194500.00,United States,2021,544379,Finance,Business Services
ROCCU,Roth CH Acquisition II Co. Unit,$12.00,0.18,1.523%,0.00,United States,2020,7990,Finance,Business Services
ROCCW,Roth CH Acquisition II Co. Warrant,$2.50,0.29,13.122%,0.00,United States,2021,132965,Finance,Business Services
ROCH,Roth CH Acquisition I Co. Common Stock,$26.40,2.29,9.498%,259459200.00,United States,2020,612435,Finance,Business Services
ROCHU,Roth CH Acquisition I Co. Unit,$38.41,6.65,20.938%,0.00,United States,2020,6380,Finance,Business Services
ROCHW,Roth CH Acquisition I Co. Warrant,$13.01,2.47,23.435%,0.00,United States,2020,175821,Finance,Business Services
