Symbol,Name,Last Sale,Net Change,% Change,Market Cap,Country,IPO Year,Volume,Sector,Industry
DCPH,Deciphera Pharmaceuticals Inc. Common Stock,$49.50,-1.86,-3.621%,2818204488.00,United States,2017,610170,Health Care,Major Pharmaceuticals
DCRB,Decarbonization Plus Acquisition Corporation Class A Common Stock,$17.76,1.26,7.636%,503007636.00,United States,2020,3549977,Finance,Business Services
DCRBU,Decarbonization Plus Acquisition Corporation Unit,$20.29,1.88,10.212%,0.00,United States,2020,343242,Finance,Business Services
DCRBW,Decarbonization Plus Acquisition Corporation Warrant,$5.32,0.67,14.409%,0.00,United States,2020,846709,Finance,Business Services
DCRNU,Decarbonization Plus Acquisition Corporation II Unit,$11.55,0.08,0.697%,0.00,United States,2021,1320938,Finance,Business Services
DCT,Duck Creek Technologies Inc. Common Stock,$54.35,0.00,0.00%,7121190923.00,United States,2020,509466,Technology,Computer Software: Prepackaged Software
DCTH,Delcath Systems Inc. Common Stock,$21.34,1.72,8.767%,123682052.00,United States,,143106,Health Care,Medical/Dental Instruments
DDMX,DD3 Acquisition Corp. II Class A Common Stock,$10.32,-0.20,-1.901%,74543424.00,Mexico,2021,42313,Finance,Business Services
DDMXU,DD3 Acquisition Corp. II Unit,$11.22,-0.23,-2.009%,0.00,Mexico,2020,10324,Finance,Business Services
DDMXW,DD3 Acquisition Corp. II Warrant,$1.90,-0.05,-2.564%,0.00,Mexico,2021,49049,Finance,Business Services
DDOG,Datadog Inc. Class A Common Stock,$116.42,1.52,1.323%,35453656071.00,United States,2019,2818402,Technology,Computer Software: Prepackaged Software
DENN,Denny's Corporation Common Stock,$16.75,-0.66,-3.791%,1068116010.00,United States,,1195543,Consumer Services,Restaurants
DFFN,Diffusion Pharmaceuticals Inc. Common Stock,$1.49,0.20,15.504%,95383007.00,United States,,10479818,Health Care,Major Pharmaceuticals
DFH,Dream Finders Homes Inc. Class A Common Stock,$29.91,0.00,0.00%,2767317527.00,United States,2021,238768,Capital Goods,Homebuilding
DFHT,Deerfield Healthcare Technology Acquisitions Corp. Class A Common Stock,$13.48,0.09,0.672%,242218750.00,United States,2020,76244,Finance,Business Services
DFHTU,Deerfield Healthcare Technology Acquisitions Corp. Unit,$14.04,0.4399,3.235%,0.00,United States,2020,3213,Finance,Business Services
DFHTW,Deerfield Healthcare Technology Acquisitions Corp. Warrant,$3.66,0.00,0.00%,0.00,United States,2020,4,Finance,Business Services
DFPH,DFP Healthcare Acquisitions Corp. Class A Common Stock,$10.83,0.07,0.651%,311362500.00,United States,2020,19579,Finance,Business Services
DFPHU,DFP Healthcare Acquisitions Corp. Unit,$11.16,-0.08,-0.712%,0.00,United States,2020,114692,Finance,Business Services
DFPHW,DFP Healthcare Acquisitions Corp. Warrant,$2.225,-0.005,-0.224%,0.00,United States,2020,5057,Finance,Business Services
DGICA,Donegal Group Inc. Class A Common Stock,$14.30,0.22,1.563%,425739100.00,United States,,67732,Finance,Property-Casualty Insurers
DGICB,Donegal Group Inc. Class B Common Stock,$12.75,0.00,0.00%,379592554.00,United States,1986,476,Finance,Property-Casualty Insurers
DGII,Digi International Inc. Common Stock,$25.15,0.64,2.611%,744939680.00,United States,1989,720854,Technology,Computer Communications Equipment
DGLY,Digital Ally Inc. Common Stock,$2.74,0.07,2.622%,110891063.00,United States,,9770550,Technology,Radio And Television Broadcasting And Communications Equipment
DGNS,Dragoneer Growth Opportunities Corp. II Class A Ordinary Shares,$13.00,0.31,2.443%,410540000.00,United States,2020,196865,Finance,Business Services
DHC,Diversified Healthcare Trust Common Shares of Beneficial Interest,$4.51,0.08,1.806%,1074590836.00,United States,,1163955,Consumer Services,Real Estate Investment Trusts
DHCNI,Diversified Healthcare Trust 5.625% Senior Notes due 2042,$23.29,-0.125,-0.534%,0.00,United States,,7526,Consumer Services,Real Estate Investment Trusts
DHCNL,Diversified Healthcare Trust 6.25% Senior Notes Due 2046,$24.38,0.10,0.412%,0.00,United States,,22138,Consumer Services,Real Estate Investment Trusts
DHHCU,DiamondHead Holdings Corp. Unit,$10.92,-0.05,-0.456%,0.00,United States,2021,253151,Finance,Business Services
DHIL,Diamond Hill Investment Group Inc. Class A Common Stock,$144.78,3.27,2.311%,457977651.00,United States,,11919,Finance,Investment Managers
DIOD,Diodes Incorporated Common Stock,$79.57,4.01,5.307%,4140978996.00,United States,,230385,Technology,Semiconductors
DISCA,Discovery Inc. Series A Common Stock,$43.25,0.58,1.359%,21242337927.00,United States,,7198262,Consumer Services,Television Services
DISCB,Discovery Inc. Series B Common Stock,$43.24,0.5743,1.346%,21237426403.00,United States,,1634,Consumer Services,Television Services
DISCK,Discovery Inc. Series C Common Stock,$37.00,0.58,1.593%,18172635914.00,United States,,3973734,Consumer Services,Television Services
DISH,DISH Network Corporation Class A Common Stock,$31.52,0.31,0.993%,16579786880.00,United States,1995,2091196,Consumer Services,Television Services
DJCO,Daily Journal Corp. (S.C.) Common Stock,$336.00,0.49,0.146%,463930656.00,United States,,819,Consumer Services,Newspapers/Magazines
DKNG,DraftKings Inc. Class A Common Stock,$61.97,-1.90,-2.975%,24274505797.00,United States,2019,19917211,Consumer Services,Services-Misc. Amusement & Recreation
DLCAU,Deep Lake Capital Acquisition Corp. Unit,$10.90,0.10,0.926%,0.00,United States,2021,105163,Finance,Business Services
DLHC,DLH Holdings Corp.,$11.18,0.48,4.486%,140240869.00,United States,,18339,Technology,Professional Services
DLPN,Dolphin Entertainment Inc. Common Stock,$4.65,0.18,4.027%,30505590.00,United States,,338415,Consumer Services,Other Consumer Services
DLTH,Duluth Holdings Inc. Class B Common Stock,$14.96,0.33,2.256%,491109812.00,United States,2015,192842,Consumer Services,Clothing/Shoe/Accessory Stores
DLTR,Dollar Tree Inc. Common Stock,$107.07,1.425,1.349%,25182023715.00,United States,1995,1681898,Consumer Services,Department/Specialty Retail Stores
DMAC,DiaMedica Therapeutics Inc. Common Stock,$9.50,0.12,1.279%,178021203.00,United States,2018,136240,Health Care,Major Pharmaceuticals
DMLP,Dorchester Minerals L.P. Common Units Representing Limited Partnership Interests,$13.54,0.63,4.88%,469564140.00,United States,,83547,Energy,Oil & Gas Production
DMRC,Digimarc Corporation Common Stock,$45.41,2.41,5.605%,749892748.00,United States,,157113,Technology,EDP Services
DMTK,DermTech Inc. Common Stock,$55.86,1.69,3.12%,1419960027.00,United States,2017,1805454,Health Care,Medical Specialities
DNLI,Denali Therapeutics Inc. Common Stock,$76.96,6.39,9.055%,9228927452.00,United States,2017,720563,Health Care,Biotechnology: Biological Products (No Diagnostic Substances)
DOCU,DocuSign Inc. Common Stock,$248.90,-1.47,-0.587%,47603846890.00,United States,2018,2038903,Technology,Computer Software: Prepackaged Software
DOGZ,Dogness (International) Corporation Class A Common Stock,$2.12,0.00,0.00%,62261773.00,China,2017,1680934,Consumer Durables,Miscellaneous manufacturing industries
DOMO,Domo Inc. Class B Common Stock,$74.09,-0.72,-0.962%,2218941192.00,United States,2018,331454,Technology,Computer Software: Prepackaged Software
DOOO,BRP Inc. (Recreational Products) Common Subordinate Voting Shares,$75.58,2.20,2.998%,6645003425.00,Canada,,58189,Capital Goods,Industrial Specialties
DORM,Dorman Products Inc. Common Stock,$101.88,2.74,2.764%,3289368690.00,United States,,105679,Capital Goods,Auto Parts:O.E.M.
DOX,Amdocs Limited Ordinary Shares,$76.53,1.52,2.026%,10033862228.00,Guernsey,,808958,Technology,EDP Services
DOYU,DouYu International Holdings Limited ADS,$13.72,-0.77,-5.314%,4403386666.00,China,2019,4307214,Technology,Computer Software: Programming Data Processing
DRIO,DarioHealth Corp. Common Stock,$27.11,2.12,8.483%,223675067.00,Israel,,290040,Health Care,Medical/Dental Instruments
DRIOW,DarioHealth Corp. Warrant,$0.25,-0.005,-1.961%,0.00,Israel,,176836,Health Care,Medical/Dental Instruments
DRNA,Dicerna Pharmaceuticals Inc. Common Stock,$28.13,0.72,2.627%,2111012924.00,United States,2014,758467,Health Care,Major Pharmaceuticals
DRRX,DURECT Corporation Common Stock,$2.56,0.11,4.49%,522560486.00,United States,2000,4436583,Health Care,Major Pharmaceuticals
DRTT,DIRTT Environmental Solutions Ltd. Common Shares,$2.42,0.03,1.255%,204928901.00,Canada,,192970,Technology,Computer Software: Prepackaged Software
DRVN,Driven Brands Holdings Inc. Common Stock,$32.25,0.48,1.511%,5311883213.00,United States,2021,900663,Consumer Services,Automotive Aftermarket
DSAC,Duddell Street Acquisition Corp. Class A Ordinary Shares,$11.08,0.62,5.927%,242375000.00,Hong Kong,2020,719983,Finance,Business Services
DSACU,Duddell Street Acquisition Corp. Unit,$12.20,0.02,0.164%,0.00,Hong Kong,2020,39345,Finance,Business Services
DSACW,Duddell Street Acquisition Corp. Warrant,$2.60,0.55,26.829%,0.00,Hong Kong,2020,107174,Finance,Business Services
DSGX,Descartes Systems Group Inc. (The) Common Stock,$63.20,0.27,0.429%,5339387852.00,Canada,,117955,Technology,Computer Software: Prepackaged Software
DSKE,Daseke Inc. Common Stock,$5.71,0.16,2.883%,371282324.00,United States,2015,483319,Consumer Services,Transportation Services
DSKEW,Daseke Inc. Warrant,$0.2138,-0.0062,-2.818%,0.00,United States,2015,280366,Consumer Services,Transportation Services
DSPG,DSP Group Inc. Common Stock,$17.00,0.51,3.093%,401150683.00,United States,1994,194127,Technology,Semiconductors
DSWL,Deswell Industries Inc. Common Shares,$3.2501,-0.0999,-2.982%,51726118.00,Macau,1995,12446,Consumer Non-Durables,Plastic Products
DTEA,DAVIDsTEA Inc. Common Stock,$4.43,-0.87,-16.415%,116202918.00,Canada,2015,2924321,Consumer Non-Durables,Food Chains
DTIL,Precision BioSciences Inc. Common Stock,$15.79,0.81,5.407%,888071586.00,United States,2019,966386,Health Care,Biotechnology: Biological Products (No Diagnostic Substances)
DTSS,Datasea Inc. Common Stock,$3.82,0.19,5.234%,80005492.00,China,,87618,Technology,Computer Software: Prepackaged Software
DUNEU,Dune Acquisition Corporation Unit,$10.52,0.00,0.00%,0.00,United States,2020,198832,Finance,Business Services
DUO,Fangdd Network Group Ltd. American Depositary Shares,$8.62,-0.34,-3.795%,688279106.00,China,2019,169051,Finance,Real Estate
DUOT,Duos Technologies Group Inc. Common Stock,$5.56,0.32,6.107%,19649123.00,United States,,42073,Technology,Computer Software: Prepackaged Software
DVAX,Dynavax Technologies Corporation Common Stock,$11.18,1.70,17.932%,1231732564.00,United States,2004,10344079,Health Care,Major Pharmaceuticals
DWSN,Dawson Geophysical Company Common Stock,$2.98,-0.03,-0.997%,69964655.00,United States,,114608,Energy,Oil & Gas Production
DXCM,DexCom Inc. Common Stock,$403.30,-7.73,-1.881%,38727932290.00,United States,2005,870490,Health Care,Medical/Dental Instruments
DXPE,DXP Enterprises Inc. Common Stock,$27.63,0.98,3.677%,491557511.00,United States,,49608,Capital Goods,Industrial Machinery/Components
DXYN,Dixie Group Inc. (The) Common Stock,$4.27,-0.08,-1.839%,67524439.00,United States,,262358,Consumer Durables,Home Furnishings
DYAI,Dyadic International Inc. Common Stock,$6.13,0.08,1.322%,168465622.00,United States,,84746,Health Care,Biotechnology: Biological Products (No Diagnostic Substances)
DYN,Dyne Therapeutics Inc. Common Stock,$20.31,-0.18,-0.878%,915505218.00,United States,2020,333270,Health Care,Major Pharmaceuticals
DYNT,Dynatronics Corporation Common Stock,$1.38,0.16,13.115%,19857801.00,United States,,664129,Health Care,Medical/Dental Instruments
DZSI,DZS Inc. Common Stock,$17.75,-0.05,-0.281%,460752175.00,United States,,191456,Public Utilities,Telecommunications Equipment
EA,Electronic Arts Inc. Common Stock,$142.46,1.24,0.878%,41292619930.00,United States,,2536075,Technology,Computer Software: Prepackaged Software
EACPU,Edify Acquisition Corp. Units,$10.40,0.03,0.289%,0.00,United States,2021,7804,Finance,Business Services
EAR,Eargo Inc. Common Stock,$70.31,5.93,9.211%,2684893870.00,United States,2020,222066,Health Care,Industrial Specialties
EARS,Auris Medical Holding Ltd. Common Shares 0.01 SF (Bermuda),$3.50,0.44,14.379%,24813292.00,Bermuda,2014,1835758,Health Care,Major Pharmaceuticals
EAST,Eastside Distilling Inc. Common Stock,$1.77,0.13,7.927%,17964176.00,United States,,1195938,Consumer Non-Durables,Beverages (Production/Distribution)
EBAY,eBay Inc. Common Stock,$63.84,1.61,2.587%,43439657765.00,United States,1998,9786424,Miscellaneous,Business Services
EBAYL,eBay Inc. 6.0% Notes Due 2056,$25.10,-0.01,-0.04%,0.00,United States,,41534,Miscellaneous,Business Services
EBC,Eastern Bankshares Inc. Common Stock,$16.35,0.17,1.051%,3053495818.00,United States,2020,1184578,Finance,Savings Institutions
EBIX,Ebix Inc. Common Stock,$52.43,4.57,9.549%,1623366968.00,United States,,450938,Technology,EDP Services
EBMT,Eagle Bancorp Montana Inc. Common Stock,$21.50,0.76,3.664%,145672111.00,United States,,28889,Finance,Major Banks
EBON,Ebang International Holdings Inc. Class A Ordinary Shares,$6.22,0.39,6.69%,815039796.00,China,2020,13672476,Technology,Semiconductors
EBSB,Meridian Bancorp Inc. Common Stock,$16.36,0.45,2.828%,857510398.00,United States,,66056,Finance,Major Banks
EBTC,Enterprise Bancorp Inc Common Stock,$27.68,0.56,2.065%,330438166.00,United States,,10243,Finance,Major Banks
ECHO,Echo Global Logistics Inc. Common Stock,$28.06,0.00,0.00%,746620171.00,United States,2009,113670,Transportation,Oil Refining/Marketing
ECOL,US Ecology Inc Common Stock,$37.72,1.49,4.113%,1188644861.00,United States,,179390,Public Utilities,Environmental Services
ECOLW,US Ecology Inc. Warrant,$6.94,0.44,6.769%,0.00,United States,,4871,Public Utilities,Environmental Services
ECOR,electroCore Inc. Common Stock,$2.72,0.14,5.426%,123636123.00,United States,2018,1433787,Health Care,Biotechnology: Electromedical & Electrotherapeutic Apparatus
ECPG,Encore Capital Group Inc Common Stock,$33.78,0.82,2.488%,1058823459.00,United States,,401400,Finance,Finance Companies
EDAP,EDAP TMS S.A. American Depositary Shares,$9.00,0.48,5.634%,262274094.00,France,1997,334124,Health Care,Biotechnology: Electromedical & Electrotherapeutic Apparatus
EDIT,Editas Medicine Inc. Common Stock,$69.75,5.69,8.882%,4384932935.00,United States,2016,3296027,Health Care,Biotechnology: Biological Products (No Diagnostic Substances)
EDRY,EuroDry Ltd. Common Shares ,$8.35,0.67,8.724%,19243661.00,Greece,,72689,Consumer Services,Marine Transportation
EDSA,Edesa Biotech Inc. Common Shares,$7.06,0.18,2.616%,74292994.00,United States,,458350,Health Care,Major Pharmaceuticals
EDTK,Skillful Craftsman Education Technology Limited Ordinary Share,$3.55,0.00,0.00%,42600000.00,China,2020,354906,Consumer Services,Other Consumer Services
EDTXU,EdtechX Holdings Acquisition Corp. II Unit,$10.55,0.05,0.476%,151656250.00,United Kingdom,2020,83216,Finance,Business Services
EDUC,Educational Development Corporation Common Stock,$15.29,0.35,2.343%,127686362.00,United States,,41819,Consumer Durables,Consumer Specialties
EEFT,Euronet Worldwide Inc. Common Stock,$137.83,4.01,2.997%,7210562805.00,United States,1997,283197,Finance,Investment Bankers/Brokers/Service
EFOI,Energy Focus Inc. Common Stock,$5.09,0.16,3.245%,21327131.00,United States,,85662,Consumer Durables,Building Products
EFSC,Enterprise Financial Services Corporation Common Stock,$39.24,0.77,2.002%,1224670158.00,United States,,75578,Finance,Major Banks
EGAN,eGain Corporation Common Stock,$11.84,0.08,0.68%,366200402.00,United States,1999,314509,Technology,Computer Software: Prepackaged Software
EGBN,Eagle Bancorp Inc. Common Stock,$46.25,1.08,2.391%,1469809414.00,United States,,72442,Finance,Major Banks
EGLE,Eagle Bulk Shipping Inc. Common Stock,$21.57,-1.02,-4.515%,268070062.00,United States,,47230,Transportation,Marine Transportation
EGOV,NIC Inc Common Stock,$28.93,0.73,2.589%,1939196560.00,United States,1999,220551,Miscellaneous,Business Services
EGRX,Eagle Pharmaceuticals Inc. Common Stock,$50.45,0.98,1.981%,657370059.00,United States,2014,96186,Health Care,Major Pharmaceuticals
EH,EHang Holdings Limited ADS,$73.94,-2.46,-3.22%,4046634015.00,China,2019,2507120,Capital Goods,Military/Government/Technical
EHTH,eHealth Inc. Common Stock,$57.37,-0.36,-0.624%,1485728904.00,United States,2006,1311683,Finance,Specialty Insurers
EIGI,Endurance International Group Holdings Inc. Common Stock,$9.49,0.01,0.105%,1344859473.00,United States,2013,980362,Technology,Computer Software: Prepackaged Software
EIGR,Eiger BioPharmaceuticals Inc. Common Stock,$12.13,1.24,11.387%,394609436.00,United States,2014,539062,Health Care,Biotechnology: Biological Products (No Diagnostic Substances)
EKSO,Ekso Bionics Holdings Inc. Common Stock,$13.07,2.64,25.312%,108694146.00,United States,,843813,Capital Goods,Industrial Machinery/Components
ELDN,Eledon Pharmaceuticals Inc. Common Stock,$17.31,2.32,15.477%,247647488.00,United States,2014,148494,Health Care,Major Pharmaceuticals
ELOX,Eloxx Pharmaceuticals Inc. Common Stock,$4.00,0.17,4.439%,160611532.00,United States,,62586,Health Care,Biotechnology: Commercial Physical & Biological Resarch
ELSE,Electro-Sensors Inc. Common Stock,$6.05,0.16,2.716%,20542902.00,United States,,88752,Capital Goods,Industrial Machinery/Components
ELTK,Eltek Ltd. Ordinary Shares,$5.93,-0.02,-0.336%,25974989.00,Israel,1997,23257,Technology,Electrical Products
ELYS,Elys Game Technology Corp. Common Stock,$5.99,0.48,8.711%,99823943.00,Canada,,1333751,Technology,Computer Software: Prepackaged Software
EMCF,Emclaire Financial Corp Common Stock,$28.0705,-0.1245,-0.442%,76385781.00,United States,,456,Finance,Major Banks
EMKR,EMCORE Corporation Common Stock,$6.27,0.22,3.636%,186738488.00,United States,1997,362380,Technology,Semiconductors
EML,Eastern Company (The) Common Stock,$26.96,2.53,10.356%,168308908.00,United States,,45035,Capital Goods,Industrial Machinery/Components
ENDP,Endo International plc Ordinary Shares,$9.11,0.31,3.523%,2097963117.00,Ireland,,2754880,Health Care,Major Pharmaceuticals
ENFAU,890 5th Avenue Partners Inc. Unit,$10.64,-0.0233,-0.219%,0.00,United States,2021,35767,Finance,Business Services
ENG,ENGlobal Corporation Common Stock,$7.08,-0.10,-1.393%,195076557.00,United States,,1549481,Consumer Services,Military/Government/Technical
ENLV,Enlivex Therapeutics Ltd. Ordinary Shares,$23.10,4.10,21.579%,311013110.00,Israel,2014,3458655,Health Care,Major Pharmaceuticals
ENOB,Enochian Biosciences Inc. Common Stock,$3.87,0.18,4.878%,180906269.00,United States,,117939,Health Care,Major Pharmaceuticals
ENPH,Enphase Energy Inc. Common Stock,$197.87,4.67,2.417%,24997425032.00,United States,2012,2112183,Technology,Semiconductors
ENSG,The Ensign Group Inc. Common Stock,$84.46,0.64,0.764%,4619595613.00,United States,2007,306920,Health Care,Hospital/Nursing Management
ENTA,Enanta Pharmaceuticals Inc. Common Stock,$54.95,1.86,3.503%,1106847190.00,United States,2013,120945,Health Care,Major Pharmaceuticals
ENTG,Entegris Inc. Common Stock,$96.70,2.33,2.469%,13053767498.00,United States,2000,739428,Consumer Non-Durables,Plastic Products
ENTX,Entera Bio Ltd. Ordinary Shares,$2.02,0.38,23.171%,36833066.00,Israel,2018,2341766,Health Care,Biotechnology: Biological Products (No Diagnostic Substances)
ENTXW,Entera Bio Ltd. Warrant,$0.32,0.045,16.364%,0.00,Israel,2018,26959,Health Care,Biotechnology: Biological Products (No Diagnostic Substances)
ENVB,Enveric Biosciences Inc. Common Stock,$4.45,0.18,4.215%,58765757.00,United States,,3176871,Technology,Semiconductors
ENVIU,Environmental Impact Acquisition Corp. Unit,$10.87,0.04,0.369%,0.00,United States,2021,374868,Finance,Business Services
EOLS,Evolus Inc. Common Stock,$7.91,0.92,13.162%,266956393.00,United States,2018,1011416,Health Care,Major Pharmaceuticals
EOSE,Eos Energy Enterprises Inc. Class A Common Stock,$24.44,-0.65,-2.591%,1217171071.00,United States,,549617,Miscellaneous,Industrial Machinery/Components
EOSEW,Eos Energy Enterprises Inc. Warrant,$10.76,-0.50,-4.44%,0.00,United States,,31494,Miscellaneous,Industrial Machinery/Components
EPAY,Bottomline Technologies Inc. Common Stock,$47.34,-0.02,-0.042%,2135677445.00,United States,1999,279324,Technology,Computer Software: Prepackaged Software
EPHYU,Epiphany Technology Acquisition Corp. Unit,$10.84,0.04,0.37%,0.00,United States,2021,175019,Finance,Business Services
EPIX,ESSA Pharma Inc. Common Stock,$18.73,1.03,5.819%,543329411.00,Canada,,340143,Health Care,Major Pharmaceuticals
EPSN,Epsilon Energy Ltd. Common Share,$3.89,0.20,5.42%,92812039.00,United States,,29314,Energy,Oil & Gas Production
EPZM,Epizyme Inc. Common Stock,$11.615,0.615,5.591%,1179867473.00,United States,2013,1024034,Health Care,Major Pharmaceuticals
EQ,Equillium Inc. Common Stock,$9.33,0.84,9.894%,230707986.00,United States,2018,1307819,Health Care,Major Pharmaceuticals
EQBK,Equity Bancshares Inc. Class A Common Stock,$24.42,-0.15,-0.611%,355080378.00,United States,2015,22513,Finance,Major Banks
EQIX,Equinix Inc. Common Stock REIT,$747.41,-6.88,-0.912%,66595517293.00,United States,2000,371661,Consumer Services,Real Estate Investment Trusts
EQOS,Diginex Limited Ordinary Shares,$19.06,0.79,4.324%,711269549.00,Singapore,2019,1185637,Finance,Business Services
EQOSW,Diginex Limited Warrant,$3.85,0.56,17.021%,0.00,Singapore,2019,333549,Finance,Business Services
ERES,East Resources Acquisition Company Class A Common Stock,$10.50,-0.02,-0.19%,452812500.00,United States,2020,68290,Finance,Business Services
ERESU,East Resources Acquisition Company Unit,$11.35,-0.03,-0.264%,0.00,United States,2020,15812,Finance,Business Services
ERESW,East Resources Acquisition Company Warrant,$1.75,0.05,2.941%,0.00,United States,2020,147403,Finance,Business Services
ERIC,Ericsson American Depositary Shares,$13.33,0.18,1.369%,44442220000.00,Sweden,,5806546,Technology,Radio And Television Broadcasting And Communications Equipment
ERIE,Erie Indemnity Company Class A Common Stock,$258.71,1.18,0.458%,13527911750.00,United States,,92587,Finance,Specialty Insurers
ERII,Energy Recovery Inc. Common Stock,$14.75,0.29,2.006%,827479115.00,United States,2008,261968,Technology,Industrial Machinery/Components
ERYP,Erytech Pharma S.A. American Depositary Shares,$9.55,-2.0251,-17.495%,194752978.00,France,2017,260642,Health Care,Biotechnology: Biological Products (No Diagnostic Substances)
ESBK,Elmira Savings Bank Elmira NY Common Stock,$12.40,0.16,1.307%,43551354.00,United States,,3558,Finance,Major Banks
ESCA,Escalade Incorporated Common Stock,$22.89,0.59,2.646%,324337658.00,United States,,24703,Consumer Non-Durables,Recreational Products/Toys
ESEA,Euroseas Ltd. Common Stock (Marshall Islands),$8.66,0.40,4.843%,48498243.00,Greece,,69084,Transportation,Marine Transportation
ESGR,Enstar Group Limited Ordinary Shares,$213.59,1.70,0.802%,4909144016.00,Bermuda,,24752,Finance,Property-Casualty Insurers
ESGRO,Enstar Group Limited Depository Shares 7.00% Perpetual Non-Cumulative Preference Shares Series E,$27.11,-0.14,-0.514%,0.00,Bermuda,,17124,Finance,Property-Casualty Insurers
ESGRP,Enstar Group Limited Depositary Shares Each Representing 1/1000th of an interest in Preference Shares,$28.6764,-0.0536,-0.187%,0.00,Bermuda,,10276,Finance,Property-Casualty Insurers
ESLT,Elbit Systems Ltd. Ordinary Shares,$143.53,2.01,1.42%,6344049539.00,Israel,,28637,Capital Goods,Military/Government/Technical
ESPR,Esperion Therapeutics Inc. Common Stock,$36.89,2.81,8.245%,954588733.00,United States,2013,675275,Health Care,Major Pharmaceuticals
ESQ,Esquire Financial Holdings Inc. Common Stock,$23.11,0.21,0.917%,177088232.00,United States,2017,15123,Finance,Commercial Banks
ESSA,ESSA Bancorp Inc. Common Stock,$15.62,0.03,0.192%,169021146.00,United States,,25168,Finance,Banks
ESSC,East Stone Acquisition Corporation Ordinary Shares,$10.07,-0.03,-0.297%,178274245.00,United States,2020,292743,Technology,Computer Software: Programming Data Processing
ESSCR,East Stone Acquisition Corporation Right,$0.47,0.0102,2.218%,0.00,United States,2020,77053,Technology,Computer Software: Programming Data Processing
ESSCU,East Stone Acquisition Corporation Unit,$11.10,0.00,0.00%,0.00,United States,2020,11,Technology,Computer Software: Programming Data Processing
ESSCW,East Stone Acquisition Corporation Warrant,$0.568,-0.0701,-10.986%,0.00,United States,2020,309146,Technology,Computer Software: Programming Data Processing
ESTA,Establishment Labs Holdings Inc. Common Shares,$57.02,2.08,3.786%,1336443883.00,Costa Rica,2018,182437,Health Care,Industrial Specialties
ESXB,Community Bankers Trust Corporation Common Stock (VA),$7.51,0.08,1.077%,166728977.00,United States,,72804,Finance,Major Banks
ETAC,E.Merge Technology Acquisition Corp. Class A Common Stock,$10.54,0.02,0.19%,803148000.00,United States,2020,954803,Finance,Business Services
ETACU,E.Merge Technology Acquisition Corp. Unit,$11.20,-0.03,-0.267%,0.00,United States,2020,237323,Finance,Business Services
ETACW,E.Merge Technology Acquisition Corp. Warrant,$2.09,-0.11,-5.00%,0.00,United States,2020,255326,Finance,Business Services
ETNB,89bio Inc. Common Stock,$24.00,0.99,4.302%,477092448.00,United States,2019,129361,Health Care,Major Pharmaceuticals
ETON,Eton Pharmaceuticals Inc. Common Stock,$10.05,0.17,1.721%,243346007.00,United States,2018,489964,Health Care,Major Pharmaceuticals
ETSY,Etsy Inc. Common Stock,$231.69,0.57,0.247%,29214015913.00,United States,2015,2989281,Miscellaneous,Business Services
ETTX,Entasis Therapeutics Holdings Inc. Common Stock,$3.53,0.24,7.295%,125228307.00,United States,2018,717856,Health Care,Major Pharmaceuticals
EUCR,Eucrates Biomedical Acquisition Corp. Ordinary Shares,$10.38,-0.12,-1.143%,0.00,United States,2020,38562,Finance,Business Services
EUCRU,Eucrates Biomedical Acquisition Corp. Unit,$10.80,0.05,0.465%,0.00,United States,2020,62068,Finance,Business Services
EUCRW,Eucrates Biomedical Acquisition Corp. Warrant,$1.75,-0.126,-6.716%,0.00,United States,2020,10488,Finance,Business Services
EUSGU,European Sustainable Growth Acquisition Corp. Unit,$10.89,-0.11,-1.00%,0.00,United States,2021,162060,Finance,Business Services
